<?xml version="1.0" encoding="UTF-8"?>
<!DOCTYPE boite SYSTEM "boite.dtd" >
<!--
To change this license header, choose License Headers in Project Properties.
To change this template file, choose Tools | Templates
and open the template in the editor.
-->


<boite>
    <couleur typeDeCouleur="rouge" />       
    <couleur typeDeCouleur="bleu" />
    <capacite>2000</capacite>
    <dimensions>
        
        <largeur>10</largeur>
        <hauteur>20</hauteur>
        <longueur>10</longueur>
    </dimensions>
    
</boite>
